Author,Documents,h-index,Affiliation,City,Country/Territory
"Chakraborty, Arunasis  Chakraborty, A.",50.0,10.0,Indian Institute of Technology Guwahati,Guwahati,India
"Karfa, Chandan  Karfa, C.",50.0,8.0,Indian Institute of Technology Guwahati,Guwahati,India
"Kaushik, Hemant B.  Kaushik, H. B.   Kaushik, Hemant B.",50.0,14.0,Indian Institute of Technology Guwahati,Guwahati,India
"Mandal, Partha Sarathi  Mandai, Partha Sarathi   Mandal, Partha   Mandal, Partha S.",50.0,8.0,Indian Institute of Technology Guwahati,Guwahati,India
"Mishra, Anil Kumar  Kumar Mishra, Anil   Mishra, A. K.   Kumar, Mishra Anil   Mishra, Anil K.",50.0,15.0,Indian Institute of Technology Guwahati,Guwahati,India
"Monisha, Javadi",50.0,19.0,Indian Institute of Technology Guwahati,Guwahati,India
"Nath, Shabari",50.0,7.0,Indian Institute of Technology Guwahati,Guwahati,India
"Ramakrishnan, Vibin",50.0,13.0,Indian Institute of Technology Guwahati,Guwahati,India
"Shaik, Rafi Ahamed  Shaik, Rafiahamed",50.0,13.0,Indian Institute of Technology Guwahati,Guwahati,India
"Singh, Deepika  Singh, D.",50.0,16.0,Indian Institute of Technology Guwahati,Guwahati,India
"Banerjee, Arnab  Banerjee, A.",49.0,11.0,Indian Institute of Technology Guwahati,Guwahati,India
"Maurya, Akhilesh Kumar  Maurya, Akhilesh   Maurya, Akhilesh K.  			                Maurya, A. K.",49.0,12.0,Indian Institute of Technology Guwahati,Guwahati,India
"Murthy, Kondepudi S.R.Krishna  Murthy, K. S.R.K.   Murthy, Kondepudi S.R.K.   Murthy, K. S.R.Krishna",49.0,15.0,Indian Institute of Technology Guwahati,Guwahati,India
"Nandi, Soumitra  Nandi, S.",49.0,21.0,Indian Institute of Technology Guwahati,Guwahati,India
"Bhowmik, Biswajit",48.0,10.0,Indian Institute of Technology Guwahati,Guwahati,India
"Dass, Anoop Kumar  Dass, Anoop K.   Dass, A. K.",48.0,15.0,Indian Institute of Technology Guwahati,Guwahati,India
"Bhattacharya, Subhaditya  Bhattacharya, S.   Bhattacharya, Subhadittya   Bhattachary, Subhaditya",47.0,17.0,Indian Institute of Technology Guwahati,Guwahati,India
"Goswami, Lalit",47.0,20.0,Indian Institute of Technology Guwahati,Guwahati,India
"Kumar, Abhishek  Kumar, A.   Abhishek, K.   Abhishek, Kumar",47.0,11.0,Indian Institute of Technology Guwahati,Guwahati,India
"Sharma, Deepak  Sharma, D.",47.0,12.0,Indian Institute of Technology Guwahati,Guwahati,India
"Baruah, Rashmi Dutta  Dutta Baruah, Rashmi   Baruah, Rashmi D.",46.0,9.0,Indian Institute of Technology Guwahati,Guwahati,India
"Dasgupta, Kaustubh  Dasgupta, K.",46.0,8.0,Indian Institute of Technology Guwahati,Guwahati,India
"Gogoi, Anup Kumar  Gogoi, Anup K.   Gogoi, A. K.   Gogoi, Anup Kr   Gogoi, Anup",46.0,8.0,Indian Institute of Technology Guwahati,Guwahati,India
"Gokhale, Sharad  Gokhale, Sharad B.   Gokhale, S.",46.0,18.0,Indian Institute of Technology Guwahati,Guwahati,India
"Goswami, Diganta  Goswami, D.",46.0,7.0,Indian Institute of Technology Guwahati,Guwahati,India
"Pradhan, Bulu",46.0,12.0,Indian Institute of Technology Guwahati,Guwahati,India
"Singh, Sanasam Ranbir  Sanasam, Ranbir",46.0,7.0,Indian Institute of Technology Guwahati,Guwahati,India
"Dasmahapatra, Ashok Kumar  Dasmahapatra, Ahsok Kumar   Dasmahapatra, Ashok K.   DASMAHAPATRA, Ashok Kumar",45.0,13.0,Indian Institute of Technology Guwahati,Guwahati,India
"Kakoty, S. K.  Kakoty, Sashindra K.   Kakoty, S. K.   Kakoty, Sashindra Kumar",45.0,9.0,Indian Institute of Technology Guwahati,Guwahati,India
"Kumar, Aviral  Kumar, Atul   Kumar, A.   Kumar, Ajay",45.0,13.0,Indian Institute of Technology Guwahati,Guwahati,India
"Mahanta, Anil  Mahanta, A.",45.0,9.0,Indian Institute of Technology Guwahati,Guwahati,India
"Rao, Seela Veerabhadreswara  Rao, S. V.",45.0,16.0,Indian Institute of Technology Guwahati,Guwahati,India
"Dasu, Veeranki Venkata  Dasu, Venkata V.   Dasu, V. V.   Dasu, V. Venkata   Dasu, Veeranki V.   Veeranki Dasu, V.",44.0,16.0,Indian Institute of Technology Guwahati,Guwahati,India
"Dey, Tarak Nath  Dey, Tarak N.   Dey, T. N.",44.0,13.0,Indian Institute of Technology Guwahati,Guwahati,India
"Kanaujia, Shankar Prasad  Prasad Kanaujia, Shankar   Kanaujia, Shankar P.",44.0,8.0,Indian Institute of Technology Guwahati,Guwahati,India
"Laishram, Boeing  Laishram, Boeing Singh   Singh Laishram, Boeing   Boeing Singh, Laishram   Boeing Singh, L.",44.0,10.0,Indian Institute of Technology Guwahati,Guwahati,India
"Pandey, Manmohan  Pandey, M.",44.0,10.0,Indian Institute of Technology Guwahati,Guwahati,India
"Chakrabarti, Debkumar  Chakrabarti, D.",43.0,6.0,Indian Institute of Technology Guwahati,Guwahati,India
"Ghosh, Pranab Kumar  Ghosh, P. K.   Ghosh, Pranab K.",43.0,15.0,Indian Institute of Technology Guwahati,Guwahati,India
"Mitra, Sudip  Mitra, S.",43.0,16.0,Indian Institute of Technology Guwahati,Guwahati,India
"Peela, Nageswara Rao  Peela, Nageswara R.",43.0,17.0,Indian Institute of Technology Guwahati,Guwahati,India
"Sastri, Chivukula V.  Sastri, Chivukula   Sastri, Chivukula V.   Sastri, C. V.",43.0,23.0,Indian Institute of Technology Guwahati,Guwahati,India
"Setlur, Girish S.  Setlur, G. S.   Setlur, Girish   S. Setlur, Girish   Setlur, G.",43.0,8.0,Indian Institute of Technology Guwahati,Guwahati,India
"Adda, Ravindranath  Ravindranath, Adda",42.0,13.0,Indian Institute of Technology Guwahati,Guwahati,India
"Bhowmick, Parijat  Bhowmick, P.",42.0,12.0,Indian Institute of Technology Guwahati,Guwahati,India
"Bhuyan, Bipul  Bhuyan, B.",42.0,22.0,Indian Institute of Technology Guwahati,Guwahati,India
"Sorathia, Keyur B.  Sorathia, Keyur",42.0,5.0,Indian Institute of Technology Guwahati,Guwahati,India
"Alagarsamy, Perumal  Alagarsamy, P.   Perumal, A.   Perumal, Alagarsamy",41.0,8.0,Indian Institute of Technology Guwahati,Guwahati,India
"Choudhary, Rajan",41.0,11.0,Indian Institute of Technology Guwahati,Guwahati,India
"Kumari, Poonam  kumari, Poonam   Kumari, P.",41.0,11.0,Indian Institute of Technology Guwahati,Guwahati,India
"Panda, Aditya Narayan  Panda, Aditya N.   Panda, A. N.",41.0,15.0,Indian Institute of Technology Guwahati,Guwahati,India
"Prabhu A, Ashish  Prabhu, Ashish Anand   Prabhu, A.   Prabhu, Ashish A.   Prabhu, Ashish   Prabhu, A. Anand",41.0,14.0,Indian Institute of Technology Guwahati,Guwahati,India
"Shelke, Amit  Shelke, A.",41.0,12.0,Indian Institute of Technology Guwahati,Guwahati,India
"Chaturvedi, Rakhi  Chaturvedi, R.",40.0,17.0,Indian Institute of Technology Guwahati,Guwahati,India
"Singh, Baleshwar  Singh, B.",40.0,8.0,Indian Institute of Technology Guwahati,Guwahati,India
"Bhabak, Krishna Pada  Bhabak, Krishna P.",39.0,17.0,Indian Institute of Technology Guwahati,Guwahati,India
"Kumar, Akshai  Kumar, A.",39.0,13.0,Indian Institute of Technology Guwahati,Guwahati,India
"Nandy, Malay Kumar  Nandy, Malay K.   Nandy, M. K.",39.0,7.0,Indian Institute of Technology Guwahati,Guwahati,India
"Pati, Sukanta  Pati, S.   Patió, Sukanta",39.0,15.0,Indian Institute of Technology Guwahati,Guwahati,India
"Satpati, Priyadarshi",39.0,9.0,Indian Institute of Technology Guwahati,Guwahati,India
"Tripathy, Praveen  Tripathy, Pravin   Tripathy, P.   Tripathya, Praveen",39.0,10.0,Indian Institute of Technology Guwahati,Guwahati,India
"Anand, Ashish",38.0,12.0,Indian Institute of Technology Guwahati,Guwahati,India
"Chakrabarty, Siddhartha P.  Chakrabarty, S. P.   Chakrabarty, Siddhartha P.   CHAKRABARTY, SIDDHARTHA P.",38.0,9.0,Indian Institute of Technology Guwahati,Guwahati,India
"Chakraborty, Sovan  Chakraborty, S.",38.0,21.0,Indian Institute of Technology Guwahati,Guwahati,India
"Jawed, Mohammad  Jawed, M.   Jawed, Mohammed   Jawef, Mohammad",38.0,13.0,Indian Institute of Technology Guwahati,Guwahati,India
"Mishra, Tapan  Mishra, T.",38.0,13.0,Indian Institute of Technology Guwahati,Guwahati,India
"Punekar, Ravi Mokashi  Punekar, R. M.   Mokashi-Punekar, Ravi   Mokashi Punekar, Ravi",38.0,3.0,Indian Institute of Technology Guwahati,Guwahati,India
"Rai, Brijesh Kumar  Kumar Rai, Brijesh   Rai, B. K.   Rai, Brijesh K.",38.0,9.0,Indian Institute of Technology Guwahati,Guwahati,India
"Swaminathan, Rajaram  Swaminathan, R.",38.0,19.0,Indian Institute of Technology Guwahati,Guwahati,India
"Bharat, Tadikonda Venkata  Bharat, Tadikonda V.   Bharat, T. V.   Bharat, T. Venkata",37.0,10.0,Indian Institute of Technology Guwahati,Guwahati,India
"Bharti, Rishikesh  Bharti, R.",37.0,7.0,Indian Institute of Technology Guwahati,Guwahati,India
"Khwairakpam, Meena  Khwairakpam, M.   Khwairkpam, Meena",37.0,14.0,Indian Institute of Technology Guwahati,Guwahati,India
"Ray, Manabendra  Ray, M.",37.0,21.0,Indian Institute of Technology Guwahati,Guwahati,India
"Salve, Urmi Ravindra  Salve, Urmi   salve, Urmi R.   Salve, U. R.   Salve, Urmi R.",37.0,7.0,Indian Institute of Technology Guwahati,Guwahati,India
"De, A. K.  De, A. K.   De, Arnab Kr   De, Arnab Kumar   De, Arnab K.   Kumar De, Arnab",36.0,11.0,Indian Institute of Technology Guwahati,Guwahati,India
"Harsha, Choudhary",36.0,17.0,Indian Institute of Technology Guwahati,Guwahati,India
"Jha, Ravindra Kumar  Jha, Ravindra",36.0,10.0,Indian Institute of Science,Bengaluru,India
"Karthik, Kannan  Karthik, K.",36.0,5.0,Indian Institute of Technology Guwahati,Guwahati,India
"Dalal, Durga C.  Dalal, D. C.   Dalal, D.",35.0,13.0,Indian Institute of Technology Guwahati,Guwahati,India
"Gaikwad, Vishwajit M.  Gaikwad, V. M.   Gaikwad, Vishwajit M.   Gaikwad, Vishwajit",35.0,12.0,Indian Institute of Technology Guwahati,Guwahati,India
"Girisa, Sosmitha",35.0,12.0,Indian Institute of Technology Guwahati,Guwahati,India
"Kumar, Manish",35.0,10.0,Indian Institute of Technology Guwahati,Guwahati,India
"Mondal, Piyal  Mondal, P.",34.0,11.0,Indian Institute of Technology Guwahati,Guwahati,India
"Srimani, Dipankar  Srimani, DIpankar",34.0,21.0,Indian Institute of Technology Guwahati,Guwahati,India
"Thummer, Rajkumar P.  Thummer, Rajkumar P.",34.0,9.0,Indian Institute of Technology Guwahati,Guwahati,India
"Baruah, Niharika",33.0,5.0,Indian Institute of Technology Guwahati,Guwahati,India
"Das, Pradip Kumar 				                Das, Pradip K.   Das, Pradeep Kumar   Das Pradip, K.",33.0,9.0,Indian Institute of Technology Guwahati,Guwahati,India
"Deka, Kuntal",33.0,6.0,Indian Institute of Technology Guwahati,Guwahati,India
"Gupta, Raghvendra  Gupta, R.",33.0,13.0,Indian Institute of Technology Guwahati,Guwahati,India
"Kumar, Abhinay  Kumar, A.",33.0,7.0,Indian Institute of Technology Guwahati,Guwahati,India
"Mondal, Avijit  Mondal, A.",33.0,9.0,Indian Institute of Technology Guwahati,Guwahati,India
"Sahu, Aryabartta",33.0,5.0,Indian Institute of Technology Guwahati,Guwahati,India
"Singh, Ripudaman  Singh, R.",33.0,11.0,Indian Institute of Technology Guwahati,Guwahati,India
"Talukdar, Anjan Kumar  Talukdar, Anjan Kr",33.0,7.0,Indian Institute of Technology Guwahati,Guwahati,India
"Thakur, Krishan Kumar  Thakur, K. K.   Thakur, Krishan K.   Thakur, Krishan",33.0,14.0,Indian Institute of Technology Guwahati,Guwahati,India
"Thangavel, Ranjith",33.0,18.0,Indian Institute of Technology Guwahati,Guwahati,India
"Bhaduri, Purandar  Bhaduri, P.",32.0,8.0,Indian Institute of Technology Guwahati,Guwahati,India
"Chowdhury, Anirban  Chowdhuri, Anirban",32.0,7.0,Indian Institute of Technology Guwahati,Guwahati,India
"Haq, Izharul",32.0,12.0,Indian Institute of Technology Guwahati,Guwahati,India
"Shadangi, Krushna Prasad  Shadangi, K. P.   Prasad Shadangi, Krushna",32.0,13.0,Indian Institute of Technology Guwahati,Guwahati,India
"Veeranki, Venkata Dasu  Veeranki, V. D.",32.0,13.0,Indian Institute of Technology Guwahati,Guwahati,India
"Borgohain, Chandan  Borgohain, C.",31.0,12.0,Indian Institute of Technology Guwahati,Guwahati,India
"Das, Bikul  Das, B.",31.0,20.0,Indian Institute of Technology Guwahati,Guwahati,India
"Kapil, Sajan  Kapil, S.",31.0,8.0,Indian Institute of Technology Guwahati,Guwahati,India
"Kumar, Adepu Kiran  Kumar, A.   Kumar, A. Kiran   Kumar, Adepu K.   Kumar, A. K.   Kumar, Kiran",31.0,16.0,Indian Institute of Technology Guwahati,Guwahati,India
"Kumar, M. C.  Kumar, M. C.",31.0,12.0,Indian Institute of Technology Guwahati,Guwahati,India
"Chadha, Alka  Chadha, A.   Chaddha, Alka",30.0,9.0,Indian Institute of Technology Guwahati,Guwahati,India
"Chaturvedi, Harsh  Chaturvedi, H.",30.0,5.0,Indian Institute of Technology Guwahati,Guwahati,India
"Chaudhary, Nitin",30.0,11.0,Indian Institute of Technology Guwahati,Guwahati,India
"Kapoor, Kalpesh  Kapoor, K.",30.0,8.0,Indian Institute of Technology Guwahati,Guwahati,India
"Nandy, Arup Kumar 				  Nandy, A.   Nandy, Arup",30.0,7.0,Indian Institute of Technology Guwahati,Guwahati,India
"Pandey, Kanhaiya  Pandey, K.",30.0,12.0,Indian Institute of Technology Guwahati,Guwahati,India
"Sarkar, Priyanka  Sarkar, P.",30.0,16.0,Indian Institute of Technology Guwahati,Guwahati,India
"De, Mahuya  De, M.",29.0,11.0,Indian Institute of Technology Guwahati,Guwahati,India
"Deka, Bhupen  Deka, B.",29.0,9.0,Indian Institute of Technology Guwahati,Guwahati,India
"Khatua, Manas  Khatua, M.",29.0,8.0,Indian Institute of Technology Guwahati,Guwahati,India
"Limaye, Anil M.  Anil Mukund, Limaye   Limaye, Anil M.   Limaye, Anil Mukund   Limaye, A. M.",29.0,10.0,Indian Institute of Technology Guwahati,Guwahati,India
"Mahanta, Nilkamal",29.0,15.0,Indian Institute of Technology Guwahati,Guwahati,India
"Narayan, Jyotindra",29.0,6.0,Indian Institute of Technology Guwahati,Guwahati,India
"Padma Kumar, P.  Padmanabhan, Padma Kumar   Padma Kumar, P.   Padma kumar, P.   Kumar, P. Padma   Kumar P, Padma   Kumar P., Padma   Kumar, Padmanabhan Padma",29.0,16.0,Indian Institute of Technology Guwahati,Guwahati,India
"Sinharoy, Arindam  Roy, Arindam Sinha",29.0,13.0,Indian Institute of Technology Guwahati,Guwahati,India
"Bandopadhya, Dibakar  Bandopadhya, D.",28.0,8.0,Indian Institute of Technology Guwahati,Guwahati,India
"Bhunia, Bibhas Kumar  Bhunia, Bibhas K.   Bhunia, Bibhas",28.0,14.0,Indian Institute of Technology Guwahati,Guwahati,India
"Chopra, Ribhu",28.0,8.0,Indian Institute of Technology Guwahati,Guwahati,India
"Chouhan, Sonali",28.0,7.0,Indian Institute of Technology Guwahati,Guwahati,India
"Kalita, Pratul Chandra  Kalita, Pratul Ch   Kalita, Pratul C.   Kalita, Pratul",28.0,2.0,Indian Institute of Technology Guwahati,Guwahati,India
"Mishra, Darpan",28.0,4.0,Indian Institute of Technology Guwahati,Guwahati,India
"Afroz, Mohammad Adil  Adil Afroz, Mohammad",27.0,13.0,Indian Institute of Technology Guwahati,Guwahati,India
"Alam, Rafikul",27.0,8.0,Indian Institute of Technology Guwahati,Guwahati,India
"Arul Manikandan, N.            Manikandan, Natarajan Arul   Arul Manikandan, N.   Manikandan, N. Arul",27.0,13.0,Indian Institute of Technology Guwahati,Guwahati,India
"Chunchu, Mallikarjuna  Mallikarjuna, C.   Mallikarjuna, Ch",27.0,10.0,Indian Institute of Technology Guwahati,Guwahati,India
"Dasgupta, Anirban",27.0,9.0,Indian Institute of Technology Guwahati,Guwahati,India
"Kalita, Dipankar  Kalita, Dipsikha   Kalita, D.",27.0,14.0,Indian Institute of Technology Guwahati,Guwahati,India
"Pekkat, Sreeja  Sreeja, Pekkat   Sreeja, P.",27.0,10.0,Indian Institute of Technology Guwahati,Guwahati,India
"Rout, Saroj Kumar  Rout, Saroj K.",27.0,23.0,Indian Institute of Technology Guwahati,Guwahati,India
"Saxena, Varun",27.0,13.0,Indian Institute of Technology Guwahati,Guwahati,India
"Srinivasan, Ananthakrishanan  Srinivasan, A.",27.0,11.0,Indian Institute of Technology Guwahati,Guwahati,India
"Yadav, Himanshu S.  Yadav, Himanshu   Yadav, H. S.",27.0,7.0,Indian Institute of Technology Guwahati,Guwahati,India
"Arrawatia, Mahima  Arrawatia, M.",26.0,9.0,Indian Institute of Technology Guwahati,Guwahati,India
"Datta, Sumit",26.0,7.0,Indian Institute of Technology Guwahati,Guwahati,India
"Dey, Anamika  Dey, A.",26.0,11.0,Indian Institute of Technology Guwahati,Guwahati,India
"Gogoi, Abhijit",26.0,11.0,Indian Institute of Technology Guwahati,Guwahati,India
"Gupta, Cota Navin  Gupta, C. N.",26.0,12.0,Indian Institute of Technology Guwahati,Guwahati,India
"Kalita, Dipjyoti  Kalita, D.   Kalita, Dibashmoni   Kalita, Dhruba J.   Kalita, Dhruba Jyoti",26.0,7.0,Indian Institute of Technology Guwahati,Guwahati,India
"Nagotu, Shirisha",26.0,11.0,Indian Institute of Technology Guwahati,Guwahati,India
"Samudravijaya, K.  Samudravijaya, K.",26.0,7.0,Indian Institute of Technology Guwahati,Guwahati,India
"Saradhi, Vijaya V.  Vedula, Vijaya Saradhi   Saradhi, Vijaya   Saradhi, V. Vijaya",26.0,4.0,Indian Institute of Technology Guwahati,Guwahati,India
"Sarma, Manabendra  Sarma, M.",26.0,7.0,Indian Institute of Technology Guwahati,Guwahati,India
"Sharma, Swati  Sharma, S.",26.0,12.0,Indian Institute of Technology Guwahati,Guwahati,India
"Bhattacharjee, Sukanta",25.0,7.0,Indian Institute of Technology Guwahati,Guwahati,India
"Chakrabarti, Sayan K.  Chakrabarti, Sayan K.   Chakrabarti, S. K.   Chakrabarti, S.   Chakrabarti, Sayan   Chakrabartiy, Sayan",25.0,11.0,Indian Institute of Technology Guwahati,Guwahati,India
"Chatterjee, Sunanda  Chatterjee, S.",25.0,12.0,Indian Institute of Technology Guwahati,Guwahati,India
"Goswami, Papori  Goswami, P.",25.0,15.0,Natural Products Chemistry Division,Jorbat,India
"Goswami, Upashi  Goswami, U.",25.0,12.0,Indian Institute of Technology Guwahati,Guwahati,India
"Nandi, Sunit Kumar  Nandiy, Sunit Kumar   Nandi, Sunit K.   Nandi, Sunit",25.0,8.0,Indian Institute of Technology Guwahati,Guwahati,India
"Shekhawat, Hanumant Singh  Shekhawat, H. S.",25.0,3.0,Indian Institute of Technology Guwahati,Guwahati,India
"Tiwari, Tapeshwar  Tiwari, T.",25.0,4.0,Indian Institute of Technology Guwahati,Guwahati,India
"Ghosh, Tabli  Ghosh, T.",24.0,8.0,Indian Institute of Technology Guwahati,Guwahati,India
"Kancharla, Pavan K.",24.0,13.0,Indian Institute of Technology Guwahati,Guwahati,India
"Kulkarni, Rishikesh",24.0,5.0,Indian Institute of Technology Guwahati,Guwahati,India
"Kumar, Manjesh             Kumar, M. Ashok   Kumar, M.   Kumar, M. A.",24.0,4.0,Indian Institute of Technology Guwahati,Guwahati,India
"Kumar, Upendra",24.0,7.0,Indian Institute of Technology Guwahati,Guwahati,India
"Kundu, Lal Mohan",24.0,10.0,Indian Institute of Technology Guwahati,Guwahati,India
"Mallajosyula, Arun Tej  Mallajosyula, Arun T.   Tej Mallajosyula, Arun   Mallajoysula, Arun T.",24.0,11.0,Indian Institute of Technology Guwahati,Guwahati,India
"Mohan, Mood",24.0,14.0,Indian Institute of Technology Guwahati,Guwahati,India
"Pankaj, Pardeep",24.0,7.0,Indian Institute of Technology Guwahati,Guwahati,India
"Raha, Udit  Raha, U.",24.0,9.0,Indian Institute of Technology Guwahati,Guwahati,India
"Rajesh, Alentattil  Rajesh, A.",24.0,4.0,Indian Institute of Technology Guwahati,Guwahati,India
"Sarangapany, Saran  Saran, S.   Saran, Sarangapany   Sarangapani, Saran",24.0,12.0,Indian Institute of Technology Guwahati,Guwahati,India
"Barbora, Lepakshi  Barbora, L.",23.0,10.0,Indian Institute of Technology Guwahati,Guwahati,India
"Barua, Anamika",23.0,7.0,Indian Institute of Technology Guwahati,Guwahati,India
"Bharti, Gaurav Kumar  Bharti, Gaurav K.   Bharti, G. K.",23.0,10.0,Indian Institute of Technology Guwahati,Guwahati,India
"Das, Debarshi",23.0,5.0,Indian Institute of Technology Guwahati,Guwahati,India
"Das, Sandip  Das, S.",23.0,8.0,Indian Institute of Technology Guwahati,Guwahati,India
"Farooq, Rayees",23.0,8.0,Indian Institute of Technology Guwahati,Guwahati,India
"Gadi, Vinay Kumar  Gadi, Vinay   Gadi, V.   Gadi, V. K.",23.0,9.0,Indian Institute of Technology Guwahati,Guwahati,India
"Ghosh, Sayandeep  Ghosh, S.",23.0,7.0,Indian Institute of Technology Guwahati,Guwahati,India
"Gupta, Prerak",23.0,12.0,Indian Institute of Technology Guwahati,Guwahati,India
"Inkulu, Rajasekhar  Inkulu, R.",23.0,6.0,Indian Institute of Technology Guwahati,Guwahati,India
"Khatoon, Elina  Khatoon, E.",23.0,8.0,Indian Institute of Technology Guwahati,Guwahati,India
"Maurya, Rahulkumar  Maurya, Rahulkumar R.",23.0,18.0,Indian Institute of Technology Guwahati,Guwahati,India
"Nair, Archana M.  Nair, Archana M.   Nair, Archana",23.0,6.0,Indian Institute of Technology Guwahati,Guwahati,India
"Paul, Sumana",23.0,10.0,Indian Institute of Technology Guwahati,Guwahati,India
"Pramanik, Prativa  Pramanik, P.",23.0,9.0,Indian Institute of Technology Guwahati,Guwahati,India
"Prasanna Venkatesh, R.  Rajaraman, Prasanna Venkatesh",23.0,8.0,Indian Institute of Technology Guwahati,Guwahati,India
"Sarma, Biswajit Dev  Sarma, Biswajit D.   Sarma, B. D.   Dev Sarma, Biswajit",23.0,8.0,Indian Institute of Technology Guwahati,Guwahati,India
"Singh, Arbind Kumar  Singh, A. K.   Singh, Arbind K.",23.0,6.0,Indian Institute of Technology Guwahati,Guwahati,India
"Tripathi, Nachiketa",23.0,9.0,Indian Institute of Technology Guwahati,Guwahati,India
"Vairakannu, Prabu  Prabu, V.",23.0,10.0,Indian Institute of Technology Guwahati,Guwahati,India
"Bain, Dipankar",22.0,12.0,Indian Institute of Technology Guwahati,Guwahati,India
"Basu, Srestha",22.0,9.0,Indian Institute of Technology Guwahati,Guwahati,India
"Das, Avijit",22.0,9.0,Indian Institute of Technology Guwahati,Guwahati,India
"Gupta, Ritesh Kant  Gupta, Ritesh K.",22.0,8.0,Indian Institute of Technology Guwahati,Guwahati,India
"Gupta, Ruchika",22.0,6.0,Indian Institute of Technology Guwahati,Guwahati,India
"Kadolkar, Charudatt Y.  Kadolkar, C.   Kadolkar, Charudatt   Kadolkar, C. Y.",22.0,4.0,Indian Institute of Technology Guwahati,Guwahati,India
"Kashyap, Salil  Kashyap, S.",22.0,8.0,Indian Institute of Technology Guwahati,Guwahati,India
"Kumar, Sandeep  Kumar, S.",22.0,11.0,Indian Institute of Technology Guwahati,Guwahati,India
"Kundu, Ashis  Kundu, A.   Kundu, Ashish",22.0,10.0,Shenzhen University,Shenzhen,China
"Muthiah, Arunachalam  Arunachalam, M.   Arunachalam, Muthiah",22.0,7.0,Indian Institute of Technology Guwahati,Guwahati,India
"Nallam, Nagarjuna",22.0,4.0,Indian Institute of Technology Guwahati,Guwahati,India
"Pradhan, Sourav",22.0,16.0,Indian Institute of Technology Guwahati,Guwahati,India
"Saha, Biswanath  Saha, B.",22.0,12.0,Indian Institute of Technology Guwahati,Guwahati,India
"Saikia, Arupjyoti",22.0,6.0,Indian Institute of Technology Guwahati,Guwahati,India
"Sarma, Sidananda  Sarma, S.",22.0,8.0,Indian Institute of Technology Guwahati,Guwahati,India
"Sharma, Hrishikesh K.  Sharma, H.   Sharma, H. K.   Sharma, Hrishikesh",22.0,5.0,Indian Institute of Technology Guwahati,Guwahati,India
"Siddagangaiah, Anjan Kumar",22.0,5.0,Indian Institute of Technology Guwahati,Guwahati,India
"Tamuli, Ranjan  Tamuli, R.",22.0,10.0,Indian Institute of Technology Guwahati,Guwahati,India
"Venkata Dasu, Veeranki  Venkata Dasu, V.",22.0,9.0,Indian Institute of Technology Guwahati,Guwahati,India
"Arun, S.",21.0,7.0,Indian Institute of Technology Guwahati,Guwahati,India
"Chattopadhyay, Arup",21.0,4.0,Indian Institute of Technology Guwahati,Guwahati,India
"Choudhary, Tilendra",21.0,8.0,Indian Institute of Technology Guwahati,Guwahati,India
"Das, Niladri  Das, N. S.   Das, Niladri Sekhar   Das, Niladri S.",21.0,6.0,Indian Institute of Science,Bengaluru,India
"Dutta, Sumana  Dutta, S.",21.0,10.0,Indian Institute of Technology Guwahati,Guwahati,India
"Gupta, Abhay",21.0,4.0,Indian Institute of Technology Guwahati,Guwahati,India
"Khan, Mohd Mansoor  Khan, Mansoor   Mansoor Khan, Mohd   Khan, Mohd M.",21.0,4.0,Indian Institute of Information Technology Guwahati,Guwahati,India
"Minz, Manoranjan",21.0,3.0,Indian Institute of Technology Guwahati,Guwahati,India
"Mitra, Pinaki",21.0,5.0,Indian Institute of Technology Guwahati,Guwahati,India
"Mitra, Shirsendu",21.0,6.0,Indian Institute of Technology Guwahati,Guwahati,India
"Parama, Dey",21.0,9.0,Indian Institute of Technology Guwahati,Guwahati,India
"Roy, Kuldeep  Kuldeep",21.0,11.0,Indian Institute of Technology Guwahati,Guwahati,India
"Saikia, Anupam  Saikia, A.",21.0,3.0,Indian Institute of Technology Guwahati,Guwahati,India
"Sailo, Bethsebie Lalduhsaki  Sailo, Bethsebie L.",21.0,12.0,Indian Institute of Technology Guwahati,Guwahati,India
"Singh, Hemant Kumar  Singh, Hemant K.",21.0,9.0,Indian Institute of Technology Guwahati,Guwahati,India
"Srivyas, Pranav Dev  Srivyas, P. D.",21.0,5.0,Indian Institute of Technology Guwahati,Guwahati,India
"Bhattacherjee, Debojit  Bhattacherjee, D.",20.0,7.0,Indian Institute of Technology Guwahati,Guwahati,India
"Dasari, Kiran  Dasari, K.",20.0,8.0,Indian Institute of Technology Guwahati,Guwahati,India
"Dasgupta, Antara",20.0,17.0,Indian Institute of Technology Guwahati,Guwahati,India
"Dash, Satyabrata  Dash, S. K.",20.0,6.0,Indian Institute of Technology Guwahati,Guwahati,India
"Dhar, Debayan  Dhar, Debyan",20.0,2.0,Indian Institute of Technology Guwahati,Guwahati,India
"Dutta, Deepanjalee",20.0,11.0,Indian Institute of Technology Guwahati,Guwahati,India
"Garai, Rabindranath",20.0,8.0,Indian Institute of Technology Guwahati,Guwahati,India
"Jana, Subhashis",20.0,8.0,Indian Institute of Technology Guwahati,Guwahati,India
"Kaur, Gurvinder  Kaur, G.   Saini, Gurvinder Kaur   Saini, Gurvinder K.",20.0,7.0,Indian Institute of Technology Guwahati,Guwahati,India
"Kesh, Deepanjan",20.0,4.0,Indian Institute of Technology Guwahati,Guwahati,India
"Krishnaswamy, Srinivasan",20.0,3.0,Indian Institute of Technology Guwahati,Guwahati,India
"Mahata, Kingsuk",20.0,14.0,Indian Institute of Technology Guwahati,Guwahati,India
"Mallick, Sambit  Mallick, S.",20.0,4.0,Indian Institute of Technology Guwahati,Guwahati,India
"Nandi, Soutick  Nandi, S.",20.0,13.0,Ghani Khan Choudhury Institute of Engineering and Technology,Malda,India
"Paul, Kamal Kumar  Paul, K. K.",20.0,15.0,Indian Institute of Technology Guwahati,Guwahati,India
"Pramanik, Subrata",20.0,9.0,Rheinisch-Westfälische Technische Hochschule Aachen,Aachen,Germany
"Saha, Subhamay",20.0,4.0,Indian Institute of Technology Guwahati,Guwahati,India
"Tiwari, Avinish",20.0,7.0,Indian Institute of Technology Guwahati,Guwahati,India
"Ahmed, Sahnawaz",19.0,13.0,Indian Institute of Technology Guwahati,Guwahati,India
"Barua, Gautam  Barua, G.",19.0,7.0,Indian Institute of Technology Guwahati,Guwahati,India
